student_id,name,skills,interests,education_level
455,Curtis David,"Video Editing (Beginner), Python (Basics), Data Entry, Customer Service","Sports, Social Media",Graduate
456,Mikayla Graves,"Python (Basics), Communication, SQL (Basics), Sales","Technology, Sports",Diploma Holder
457,John Ross,"Graphic Design (Beginner), Java (Basics), Marketing, Problem Solving, Communication",Creative Arts,Graduate
458,Jennifer Johnson,"Microsoft Office, Marketing, Graphic Design (Beginner), Data Entry, Problem Solving","Social Media, Sports",Undergraduate (In Progress)
459,Matthew Pittman,"Marketing, Teamwork, Problem Solving, HTML/CSS (Basics)",Gaming,Graduate
460,John Hubbard,"HTML/CSS (Basics), Java (Basics), Python (Basics), Typing","Sports, Gaming, Technology",Graduate
461,Dylan Reynolds,"Communication, HTML/CSS (Basics), Java (Basics), Basic Computer Literacy, Teamwork","Entrepreneurship, Social Media",10th Pass
462,Ashley Owens,"Python (Basics), SQL (Basics), Social Media Management, Java (Basics)","Creative Arts, Music, Gaming",12th Pass
463,Kelli Jacobs,"Java (Basics), Basic Computer Literacy, Typing, Marketing, Problem Solving","Helping Others, Entrepreneurship, Writing",10th Pass
464,Heather Rivera MD,"Python (Basics), Social Media Management, Teamwork, Microsoft Office","Entrepreneurship, Movies, Sports",12th Pass
465,Kelsey Gomez,"SQL (Basics), Microsoft Office, Problem Solving","Music, Writing",10th Pass
466,Ricky Norman,"Microsoft Office, Social Media Management, Data Entry","Writing, Helping Others",Graduate
467,Isabel Moore,"Microsoft Office, Problem Solving, Java (Basics), Customer Service",Creative Arts,12th Pass
468,Kiara Walter,"Teamwork, Video Editing (Beginner)","Writing, Sports",12th Pass
469,Michelle Charles,"Typing, Customer Service",Technology,10th Pass
470,Lisa Cox,"Sales, SQL (Basics), Customer Service","Gaming, Technology",10th Pass
471,Rachel Short,"Java (Basics), Problem Solving, Graphic Design (Beginner), Marketing","Entrepreneurship, Reading, Creative Arts",12th Pass
472,Brenda Newman,"Marketing, Basic Computer Literacy, Graphic Design (Beginner), Customer Service, Microsoft Office","Creative Arts, Social Media",Diploma Holder
473,Tyler Barnett,"Social Media Management, Java (Basics), Sales",Helping Others,Undergraduate (In Progress)
474,Rebecca Hamilton,"HTML/CSS (Basics), Java (Basics), Customer Service","Social Media, Music, Gaming",Undergraduate (In Progress)
475,Brad Gilmore,"Data Entry, Microsoft Office, Sales","Music, Social Media",10th Pass
476,Mackenzie Myers,"Communication, Video Editing (Beginner)","Sports, Social Media",Diploma Holder
477,Alison Campbell,"Basic Computer Literacy, Social Media Management, Problem Solving, Python (Basics), Video Editing (Beginner)","Movies, Gaming, Creative Arts",12th Pass
478,Heather Carroll,"Basic Computer Literacy, Graphic Design (Beginner), Communication, Social Media Management",Music,12th Pass
479,Ryan Banks,"Problem Solving, Sales, Video Editing (Beginner), Communication, Java (Basics)","Helping Others, Sports, Technology",10th Pass
480,Mary Gardner,"HTML/CSS (Basics), Basic Computer Literacy, Java (Basics), Microsoft Office",Creative Arts,12th Pass
481,Tina Butler,"Customer Service, Marketing, Microsoft Office",Helping Others,Graduate
482,Dr. Bobby Yates,"Microsoft Office, Teamwork, Graphic Design (Beginner), Python (Basics), SQL (Basics)",Social Media,10th Pass
483,Russell White,"HTML/CSS (Basics), Communication, Problem Solving",Creative Arts,Undergraduate (In Progress)
484,Robin Gilmore,"SQL (Basics), Video Editing (Beginner), Communication, Microsoft Office",Music,Diploma Holder
485,Ricky Hawkins,"HTML/CSS (Basics), Sales, Typing, Teamwork","Entrepreneurship, Writing",Undergraduate (In Progress)
486,Cynthia Diaz,"Marketing, Data Entry, Video Editing (Beginner), Graphic Design (Beginner)",Entrepreneurship,Diploma Holder
487,Laura Novak,"Sales, Problem Solving","Reading, Music, Gaming",10th Pass
488,Joseph Wright,"Customer Service, Microsoft Office, SQL (Basics)","Creative Arts, Music, Writing",10th Pass
489,Laura Odonnell,"Communication, Video Editing (Beginner), Problem Solving, HTML/CSS (Basics), Customer Service",Entrepreneurship,12th Pass
490,Rodney Johnson,"Basic Computer Literacy, SQL (Basics), Data Entry","Sports, Social Media, Gaming",12th Pass
491,Brenda Mcfarland,"Teamwork, Problem Solving","Writing, Technology, Movies",Diploma Holder
492,Scott Hicks,"SQL (Basics), Typing","Music, Entrepreneurship",12th Pass
493,Mark Walker,"Python (Basics), Communication","Entrepreneurship, Writing",Graduate
494,Amanda Gonzalez,"Python (Basics), Communication, Java (Basics), Marketing, Basic Computer Literacy","Gaming, Social Media",Undergraduate (In Progress)
495,Lacey Harris,"Graphic Design (Beginner), Teamwork, Java (Basics)","Social Media, Creative Arts",10th Pass
496,Ryan Johnson,"Microsoft Office, Graphic Design (Beginner), Problem Solving, Customer Service, HTML/CSS (Basics)","Reading, Entrepreneurship, Writing",10th Pass
497,Victoria Johnson,"Marketing, HTML/CSS (Basics)","Movies, Writing, Gaming",12th Pass
498,Margaret Martinez,"Problem Solving, Communication, Marketing, Video Editing (Beginner), Teamwork","Technology, Reading",Diploma Holder
499,Casey Lewis,"SQL (Basics), Social Media Management, Communication, Python (Basics), Marketing","Technology, Reading, Entrepreneurship",10th Pass
500,Justin Gill,"Typing, Teamwork","Technology, Entrepreneurship, Gaming",Graduate
