student_id,name,skills,interests,education_level
229,Carolyn Anderson,"HTML/CSS (Basics), Social Media Management, SQL (Basics)",Helping Others,Graduate
230,Kenneth Washington,"Microsoft Office, Graphic Design (Beginner), Social Media Management, Typing","Music, Movies, Gaming",Diploma Holder
231,Daniel Johnson,"Basic Computer Literacy, Communication",Entrepreneurship,Graduate
232,Norman Knapp,"Social Media Management, Video Editing (Beginner), HTML/CSS (Basics), Java (Basics)","Entrepreneurship, Reading",Graduate
233,Bryan Cook,"Graphic Design (Beginner), Sales, Data Entry, Video Editing (Beginner)","Social Media, Sports",Graduate
234,Chad Reyes,"HTML/CSS (Basics), SQL (Basics), Customer Service, Sales","Technology, Gaming, Music",Graduate
235,Brett Flores,"Graphic Design (Beginner), Problem Solving, Data Entry, Video Editing (Beginner)","Social Media, Music",10th Pass
236,Tyler Johnson,"HTML/CSS (Basics), Java (Basics), Data Entry",Movies,Diploma Holder
237,Jeanette Whitehead,"Basic Computer Literacy, Sales, Teamwork, Java (Basics), Typing","Gaming, Helping Others, Music",12th Pass
238,Kyle Johnson,"Python (Basics), Microsoft Office, Data Entry, Basic Computer Literacy",Reading,Undergraduate (In Progress)
239,Timothy Young,"Java (Basics), Data Entry",Creative Arts,Diploma Holder
240,Mark Mullen,"Graphic Design (Beginner), Marketing, Basic Computer Literacy, Teamwork, Python (Basics)","Writing, Social Media, Movies",12th Pass
241,Joshua Sanders,"Problem Solving, Marketing, Social Media Management, Data Entry, HTML/CSS (Basics)",Gaming,10th Pass
242,David Rodriguez,"Typing, Graphic Design (Beginner)",Entrepreneurship,Diploma Holder
243,Caleb Hunt,"Teamwork, Problem Solving, Typing, Basic Computer Literacy","Movies, Gaming",10th Pass
244,Wayne Young,"Customer Service, Marketing",Reading,Graduate
245,Stacie Mccoy,"Social Media Management, Communication, Video Editing (Beginner), Python (Basics)","Gaming, Movies",Graduate
246,Michael Brock,"Communication, HTML/CSS (Basics), Microsoft Office, Typing","Technology, Gaming, Reading",12th Pass
247,Lori Miller,"Typing, Social Media Management, Java (Basics)","Social Media, Technology",Graduate
248,Melanie Turner,"Sales, Marketing, HTML/CSS (Basics)","Music, Entrepreneurship, Gaming",12th Pass
249,Adam Garcia,"Basic Computer Literacy, SQL (Basics), Sales","Movies, Helping Others, Writing",Diploma Holder
250,Elizabeth Walter,"Problem Solving, Basic Computer Literacy, Teamwork, Sales","Creative Arts, Movies, Music",12th Pass
251,Molly Shah,"Graphic Design (Beginner), Teamwork, Microsoft Office, Social Media Management","Sports, Social Media",Undergraduate (In Progress)
252,Andrea Collins,"SQL (Basics), Video Editing (Beginner), Communication, HTML/CSS (Basics)","Music, Movies",12th Pass
253,Cheryl Moore,"Video Editing (Beginner), Typing",Helping Others,Graduate
254,Thomas Campbell II,"HTML/CSS (Basics), Basic Computer Literacy, SQL (Basics), Communication, Java (Basics)","Helping Others, Movies",12th Pass
255,Diane Dennis,"HTML/CSS (Basics), Java (Basics), Data Entry, Social Media Management, Basic Computer Literacy","Technology, Social Media, Movies",Undergraduate (In Progress)
256,Robert Harmon,"Sales, Python (Basics)","Technology, Helping Others, Gaming",12th Pass
257,Julie Hill,"Teamwork, Customer Service, Communication, Data Entry, Marketing",Creative Arts,Diploma Holder
258,Mark Everett,"Marketing, SQL (Basics)",Movies,Undergraduate (In Progress)
259,Daniel Beasley,"Graphic Design (Beginner), Video Editing (Beginner)","Helping Others, Creative Arts, Sports",Graduate
260,Justin Rodriguez,"Python (Basics), Social Media Management, Communication, Data Entry","Reading, Entrepreneurship",Graduate
261,Lauren Hernandez,"Customer Service, Data Entry, HTML/CSS (Basics), Python (Basics)","Creative Arts, Technology",Graduate
262,Nicholas Woodard,"Data Entry, Graphic Design (Beginner)",Sports,Diploma Holder
263,Stephanie Mason,"Basic Computer Literacy, Teamwork",Social Media,10th Pass
264,Barbara Elliott,"Data Entry, Typing","Creative Arts, Movies",Diploma Holder
265,Tina Williamson,"Marketing, Java (Basics)","Helping Others, Social Media",12th Pass
266,Rebecca Smith,"SQL (Basics), Python (Basics), HTML/CSS (Basics), Sales, Video Editing (Beginner)",Movies,Undergraduate (In Progress)
267,Allen Baker,"Python (Basics), Basic Computer Literacy","Technology, Entrepreneurship",Diploma Holder
268,Kimberly Silva,"Customer Service, Data Entry, Basic Computer Literacy","Technology, Movies",Undergraduate (In Progress)
269,Stanley Kent,"Communication, SQL (Basics), Graphic Design (Beginner), Sales, HTML/CSS (Basics)","Entrepreneurship, Movies",12th Pass
270,Renee Johnson,"Sales, Problem Solving, Social Media Management, Marketing, Video Editing (Beginner)","Creative Arts, Sports",Undergraduate (In Progress)
271,Robert Collins,"Video Editing (Beginner), Communication, Java (Basics), HTML/CSS (Basics), Social Media Management","Technology, Music, Movies",Graduate
272,Jenna Williams,"Marketing, Sales, Social Media Management, Python (Basics)","Gaming, Sports, Entrepreneurship",12th Pass
273,Andrea Payne,"Python (Basics), Typing, Basic Computer Literacy",Technology,10th Pass
274,Angela Brock,"HTML/CSS (Basics), Teamwork",Sports,12th Pass
275,Carlos Francis,"Teamwork, Graphic Design (Beginner), Data Entry",Technology,Graduate
276,Christine Rosales,"Communication, Graphic Design (Beginner), Customer Service","Movies, Helping Others",Graduate
277,Christopher Taylor,"Problem Solving, Python (Basics), Typing, Marketing, HTML/CSS (Basics)","Social Media, Movies, Technology",10th Pass
278,Teresa Hall,"Customer Service, Data Entry, Java (Basics), Video Editing (Beginner), Microsoft Office",Social Media,Undergraduate (In Progress)
279,William Avila,"Customer Service, Data Entry, Video Editing (Beginner), Communication","Writing, Gaming, Reading",Undergraduate (In Progress)
280,Shannon Kim,"Video Editing (Beginner), Graphic Design (Beginner), HTML/CSS (Basics)","Sports, Technology",Diploma Holder
281,Sydney Fischer,"Marketing, Sales, HTML/CSS (Basics)","Social Media, Music, Creative Arts",Graduate
282,Kathryn George,"Customer Service, Problem Solving",Sports,Diploma Holder
283,Sharon Hopkins,"Graphic Design (Beginner), Communication, Problem Solving, Teamwork, Customer Service",Reading,Diploma Holder
284,Edward Warren,"Basic Computer Literacy, Social Media Management, Typing","Movies, Social Media",10th Pass
285,Elizabeth Rodriguez,"Java (Basics), Problem Solving","Writing, Sports",Diploma Holder
286,Hannah Smith,"Social Media Management, Problem Solving, Video Editing (Beginner), Sales",Music,10th Pass
287,Tracy Kelly,"Data Entry, Marketing","Gaming, Reading",Diploma Holder
288,Christine Holmes,"Java (Basics), SQL (Basics), Graphic Design (Beginner), Communication, Social Media Management","Movies, Creative Arts, Helping Others",Undergraduate (In Progress)
289,Mr. Lawrence Davis,"Data Entry, Graphic Design (Beginner), Java (Basics)","Technology, Movies",12th Pass
290,Caitlyn Scott,"SQL (Basics), Java (Basics)","Technology, Reading",Undergraduate (In Progress)
291,Harold Watson,"Graphic Design (Beginner), Communication, Sales",Gaming,Undergraduate (In Progress)
292,Shaun Owens,"Sales, HTML/CSS (Basics), Basic Computer Literacy","Movies, Gaming, Helping Others",Undergraduate (In Progress)
293,Michaela Fowler,"Problem Solving, Typing, Data Entry",Movies,12th Pass
294,Jack Young,"Python (Basics), Video Editing (Beginner), Teamwork","Helping Others, Creative Arts, Sports",Diploma Holder
295,Brandon Hayes,"Graphic Design (Beginner), Microsoft Office","Writing, Technology, Movies",Diploma Holder
296,Jessica Ward,"Python (Basics), Marketing, HTML/CSS (Basics), Social Media Management",Technology,12th Pass
297,Michael Ross,"Teamwork, Data Entry","Music, Creative Arts, Gaming",Graduate
298,Charles Riley,"Java (Basics), Python (Basics), Graphic Design (Beginner), SQL (Basics)","Movies, Sports, Music",Diploma Holder
299,Andrew Underwood,"Social Media Management, Python (Basics)","Music, Gaming, Movies",Graduate
300,Terry Macdonald,"Problem Solving, Social Media Management, Communication, Graphic Design (Beginner)","Helping Others, Movies, Music",12th Pass
301,Martin Hicks,"Social Media Management, Marketing, Teamwork, Video Editing (Beginner)","Helping Others, Creative Arts",10th Pass
302,James Martinez,"Microsoft Office, Social Media Management, Python (Basics), Data Entry","Creative Arts, Reading",12th Pass
303,Roberto Smith,"Python (Basics), SQL (Basics)",Creative Arts,Diploma Holder
304,Stephen Lawson,"Typing, Microsoft Office, Basic Computer Literacy, Problem Solving","Gaming, Helping Others, Movies",Diploma Holder
305,Lisa Henry,"Problem Solving, Graphic Design (Beginner), Teamwork, Sales",Creative Arts,Undergraduate (In Progress)
306,John Perry,"Customer Service, Microsoft Office, Sales, Video Editing (Beginner)","Sports, Creative Arts, Gaming",Diploma Holder
307,Zachary Patrick,"Customer Service, Graphic Design (Beginner), Basic Computer Literacy, Microsoft Office","Music, Reading",Diploma Holder
308,Marissa Ross,"Communication, Basic Computer Literacy, Data Entry",Technology,12th Pass
309,Nicholas Higgins,"Social Media Management, Problem Solving",Entrepreneurship,12th Pass
310,Betty Morris,"Marketing, Problem Solving",Creative Arts,Graduate
311,David Romero,"Python (Basics), Typing, HTML/CSS (Basics), SQL (Basics)","Helping Others, Music, Gaming",Undergraduate (In Progress)
312,Christy Quinn,"Microsoft Office, Video Editing (Beginner)","Gaming, Sports",Graduate
313,Russell Smith,"HTML/CSS (Basics), Video Editing (Beginner), Teamwork","Helping Others, Writing",Diploma Holder
314,Jacob Smith,"Teamwork, SQL (Basics), Typing, Marketing",Gaming,12th Pass
315,Dr. Donald Walker,"Sales, Problem Solving, Microsoft Office, Video Editing (Beginner), Communication","Sports, Music",Graduate
316,Jason Smith,"Microsoft Office, Social Media Management, Typing","Creative Arts, Music",Graduate
317,Patricia Ryan,"Java (Basics), Communication, Marketing, Python (Basics)","Technology, Music",10th Pass
318,Mrs. Ashley Burke DDS,"Customer Service, HTML/CSS (Basics)","Social Media, Helping Others, Music",Diploma Holder
319,Robert Whitney,"Teamwork, Marketing","Creative Arts, Social Media",Diploma Holder
320,Elaine Mcdonald,"Sales, Java (Basics)","Gaming, Music",10th Pass
321,Wendy Smith,"Data Entry, Problem Solving",Helping Others,Graduate
322,Courtney Ray,"Graphic Design (Beginner), Sales, Customer Service, SQL (Basics)",Helping Others,Diploma Holder
323,Brittany Sullivan,"Graphic Design (Beginner), Data Entry, Typing","Movies, Technology",Graduate
324,Jennifer Jimenez,"Data Entry, SQL (Basics)","Helping Others, Entrepreneurship, Social Media",Graduate
325,Brian Brown,"HTML/CSS (Basics), Teamwork, Sales","Writing, Gaming",12th Pass
326,Briana Kline,"Basic Computer Literacy, Graphic Design (Beginner), Social Media Management, SQL (Basics), HTML/CSS (Basics)",Sports,Undergraduate (In Progress)
327,Phillip Rivera,"Python (Basics), HTML/CSS (Basics), Microsoft Office, Typing, Data Entry","Creative Arts, Entrepreneurship, Reading",Graduate
328,Sandra Fleming,"Video Editing (Beginner), Basic Computer Literacy, Sales, Teamwork, Java (Basics)","Entrepreneurship, Sports",Undergraduate (In Progress)
329,Michael Kent,"Python (Basics), Basic Computer Literacy, Customer Service","Sports, Writing, Creative Arts",Diploma Holder
330,Krista Freeman,"Marketing, Social Media Management, Typing","Movies, Creative Arts",Undergraduate (In Progress)
331,Judith Reynolds,"Social Media Management, Problem Solving, Graphic Design (Beginner), Teamwork","Entrepreneurship, Gaming, Reading",Undergraduate (In Progress)
332,Jennifer Thomas,"Java (Basics), Problem Solving, Social Media Management, Video Editing (Beginner)","Sports, Movies, Gaming",12th Pass
333,Jared James,"Typing, HTML/CSS (Basics), Problem Solving","Helping Others, Technology",12th Pass
334,Michael Butler,"Graphic Design (Beginner), HTML/CSS (Basics), Sales","Social Media, Helping Others, Movies",12th Pass
335,Kelly Cruz,"Typing, Problem Solving","Entrepreneurship, Creative Arts, Movies",10th Pass
336,Destiny Herrera,"Python (Basics), Marketing, Communication, Graphic Design (Beginner), Teamwork",Technology,12th Pass
337,Jeffrey Harris DDS,"Typing, Communication, Problem Solving, Basic Computer Literacy","Creative Arts, Sports, Social Media",10th Pass
338,Walter Gonzalez,"Java (Basics), Basic Computer Literacy","Helping Others, Sports, Gaming",12th Pass
339,Donna Zimmerman,"HTML/CSS (Basics), Video Editing (Beginner), Communication","Entrepreneurship, Gaming",Graduate
340,Crystal Pacheco,"Marketing, SQL (Basics), Video Editing (Beginner), HTML/CSS (Basics), Microsoft Office","Music, Social Media, Gaming",Undergraduate (In Progress)
341,Kimberly Frye,"Social Media Management, Graphic Design (Beginner)","Social Media, Helping Others, Writing",Undergraduate (In Progress)
342,Spencer Williams,"Java (Basics), Communication, Basic Computer Literacy","Writing, Entrepreneurship",Undergraduate (In Progress)
343,Joshua Jennings,"Graphic Design (Beginner), HTML/CSS (Basics)",Movies,Undergraduate (In Progress)
344,Ryan Caldwell,"Sales, Marketing, Python (Basics)",Writing,Graduate
345,Samantha Gilbert,"Problem Solving, Sales","Movies, Gaming",12th Pass
346,Dr. Arthur Boyer,"Teamwork, Video Editing (Beginner)","Music, Sports",10th Pass
347,Andrew Wright,"Data Entry, Problem Solving, SQL (Basics), Marketing","Creative Arts, Music, Technology",10th Pass
348,Andrea Hall,"Social Media Management, Video Editing (Beginner)",Helping Others,10th Pass
349,Austin Mitchell,"Basic Computer Literacy, Microsoft Office, Sales","Writing, Helping Others, Movies",Undergraduate (In Progress)
350,Mrs. Patricia Johnson,"Sales, HTML/CSS (Basics), Microsoft Office, Data Entry","Reading, Helping Others, Writing",10th Pass
351,Corey Ibarra,"Teamwork, Marketing, Java (Basics)",Social Media,10th Pass
352,Eric Avila,"Typing, Data Entry, Sales, Customer Service",Helping Others,Undergraduate (In Progress)
353,Christopher Roberts,"Communication, Microsoft Office, Basic Computer Literacy, Social Media Management",Helping Others,10th Pass
354,Angela Benton,"Java (Basics), HTML/CSS (Basics)","Entrepreneurship, Writing, Movies",Undergraduate (In Progress)
355,Michelle Roy,"Sales, Marketing, Graphic Design (Beginner), Communication","Movies, Music",10th Pass
356,Scott Berger,"Python (Basics), Communication, Basic Computer Literacy, Customer Service",Movies,10th Pass
357,Steve Snyder,"Microsoft Office, Video Editing (Beginner), Sales",Technology,Diploma Holder
358,Leslie Moore,"Teamwork, Marketing, Python (Basics), Basic Computer Literacy","Reading, Creative Arts",Graduate
359,Frederick Carpenter Jr.,"Sales, Problem Solving, Customer Service, Basic Computer Literacy","Gaming, Movies, Writing",Graduate
360,Amanda Rios,"Data Entry, Communication, Customer Service, Problem Solving, Social Media Management","Writing, Sports, Music",12th Pass
361,Jacob Barnett,"Sales, Social Media Management",Helping Others,10th Pass
362,Damon Cole,"Graphic Design (Beginner), Communication, Teamwork, Sales","Entrepreneurship, Technology, Movies",Graduate
363,Omar Martin,"Customer Service, Python (Basics), Marketing, Graphic Design (Beginner)","Reading, Music, Entrepreneurship",10th Pass
364,Harry Martinez,"Typing, Data Entry, Video Editing (Beginner), Basic Computer Literacy",Social Media,Graduate
365,Kathleen Gomez,"Communication, HTML/CSS (Basics)","Writing, Creative Arts, Reading",Graduate
366,Elizabeth Pope,"Python (Basics), Teamwork, Social Media Management, Problem Solving, Data Entry","Helping Others, Technology",Undergraduate (In Progress)
367,Mark Peters,"Typing, Communication, Video Editing (Beginner), Sales, Social Media Management","Technology, Reading, Music",10th Pass
368,Lawrence Cameron,"Sales, Graphic Design (Beginner), Typing, Social Media Management",Technology,12th Pass
369,Heidi Neal,"Python (Basics), Basic Computer Literacy, Typing",Reading,12th Pass
370,Jessica Nelson,"SQL (Basics), Communication, Teamwork, Java (Basics), Sales","Technology, Reading, Social Media",10th Pass
371,Gabriela Miller,"Java (Basics), Teamwork, Data Entry",Sports,Undergraduate (In Progress)
372,Mr. Brian Brown,"Video Editing (Beginner), Microsoft Office, SQL (Basics), Marketing, Java (Basics)","Technology, Music, Writing",Graduate
373,John Knight,"Social Media Management, Teamwork",Social Media,Graduate
374,David Hawkins,"Java (Basics), Marketing, HTML/CSS (Basics)","Gaming, Creative Arts",10th Pass
375,Mr. Daniel Luna DDS,"Java (Basics), Typing",Social Media,Diploma Holder
376,Thomas Hicks,"Java (Basics), Graphic Design (Beginner)","Entrepreneurship, Social Media",Diploma Holder
377,Kara Potts,"Java (Basics), HTML/CSS (Basics), Sales, Data Entry, Microsoft Office",Technology,Undergraduate (In Progress)
378,Keith Petersen,"Sales, Basic Computer Literacy, Video Editing (Beginner)","Entrepreneurship, Technology",Graduate
379,Brittany Obrien,"Marketing, Customer Service","Entrepreneurship, Writing, Helping Others",Diploma Holder
380,Shelley Leach,"SQL (Basics), Video Editing (Beginner), Java (Basics)",Movies,Undergraduate (In Progress)
381,Alisha Thomas,"SQL (Basics), Python (Basics)","Movies, Reading",Diploma Holder
382,Jason Wilkinson,"Graphic Design (Beginner), Social Media Management, Microsoft Office","Social Media, Gaming",Diploma Holder
383,Kathryn Howell,"Data Entry, Typing","Social Media, Technology, Music",Undergraduate (In Progress)
384,Brian Young,"Communication, Java (Basics), SQL (Basics), Marketing, Microsoft Office","Technology, Sports, Writing",Undergraduate (In Progress)
385,Linda Mejia,"Data Entry, Typing, Python (Basics), Social Media Management, Sales","Helping Others, Music, Gaming",Undergraduate (In Progress)
386,Alex Allen,"Communication, Java (Basics), Graphic Design (Beginner), Video Editing (Beginner)","Social Media, Writing, Helping Others",12th Pass
387,Jeremy Hawkins,"Typing, Communication, Microsoft Office, Data Entry","Writing, Music",10th Pass
388,Erica Mckenzie,"Data Entry, Java (Basics), Problem Solving, Python (Basics)",Reading,Diploma Holder
389,Lindsey Jones,"Video Editing (Beginner), Communication, Java (Basics)","Music, Technology, Creative Arts",10th Pass
390,Laura Caldwell,"Graphic Design (Beginner), Basic Computer Literacy, Microsoft Office, HTML/CSS (Basics), Marketing","Helping Others, Social Media, Movies",12th Pass
391,James Morales,"Video Editing (Beginner), Python (Basics), Communication, Microsoft Office","Movies, Music",10th Pass
392,Michael Gonzalez,"Marketing, Graphic Design (Beginner), Microsoft Office","Entrepreneurship, Reading, Social Media",12th Pass
393,Anne Owen,"Typing, Graphic Design (Beginner)","Music, Writing, Gaming",Undergraduate (In Progress)
394,Elizabeth Alvarez,"Social Media Management, Communication, Graphic Design (Beginner)",Helping Others,12th Pass
395,Roger Nelson,"Social Media Management, SQL (Basics), Microsoft Office, HTML/CSS (Basics), Sales","Writing, Entrepreneurship, Technology",Graduate
396,Jeffrey Andrews,"HTML/CSS (Basics), Communication, Python (Basics), SQL (Basics)",Entrepreneurship,10th Pass
397,Scott Holloway,"Teamwork, Microsoft Office, Typing",Writing,12th Pass
398,Brittany Norton,"Communication, Customer Service, Social Media Management","Social Media, Writing, Reading",Diploma Holder
399,Keith Mcgrath,"Marketing, Communication, Basic Computer Literacy, Typing, Social Media Management","Entrepreneurship, Music, Reading",12th Pass
400,Daniel Thomas,"Social Media Management, Java (Basics), Marketing, Python (Basics), SQL (Basics)","Entrepreneurship, Technology, Creative Arts",Undergraduate (In Progress)
401,Rebecca Newton,"Social Media Management, Communication, Data Entry, Basic Computer Literacy, Teamwork","Writing, Music",10th Pass
402,Anne Garcia,"Sales, Customer Service, Python (Basics)",Technology,Diploma Holder
403,Bryan Munoz,"Customer Service, Teamwork, Basic Computer Literacy, HTML/CSS (Basics), Marketing","Technology, Music, Gaming",10th Pass
404,Scott York,"Teamwork, Social Media Management, Sales, Marketing",Sports,Graduate
405,Daniel Woods,"Customer Service, Communication","Sports, Social Media, Gaming",Undergraduate (In Progress)
406,Ricky Austin,"Typing, Video Editing (Beginner), Marketing","Reading, Entrepreneurship, Movies",Undergraduate (In Progress)
407,Lisa Berry,"Typing, Video Editing (Beginner), Java (Basics), Problem Solving, Sales","Movies, Sports",12th Pass
408,James Sandoval,"Java (Basics), Teamwork, SQL (Basics)","Creative Arts, Movies, Sports",12th Pass
409,Robert Ayala DVM,"SQL (Basics), Video Editing (Beginner), Python (Basics)","Technology, Movies, Gaming",Diploma Holder
410,Mr. Steven Lawrence DDS,"Typing, Java (Basics)","Writing, Social Media",12th Pass
411,Wanda Park,"Social Media Management, Basic Computer Literacy, Python (Basics), Data Entry, Microsoft Office",Gaming,Undergraduate (In Progress)
412,Cassidy Walters,"Python (Basics), Graphic Design (Beginner), Basic Computer Literacy, SQL (Basics)",Sports,12th Pass
413,William Miller,"HTML/CSS (Basics), Basic Computer Literacy, Sales, Video Editing (Beginner), Python (Basics)","Sports, Reading, Social Media",Diploma Holder
414,Matthew Smith,"SQL (Basics), Teamwork, Customer Service, Graphic Design (Beginner)","Gaming, Technology, Music",Graduate
415,Christopher Galloway,"Data Entry, SQL (Basics), Graphic Design (Beginner), Teamwork","Reading, Gaming, Social Media",10th Pass
416,Shane Coleman,"Microsoft Office, Video Editing (Beginner), Customer Service, Teamwork, Problem Solving","Music, Social Media, Helping Others",12th Pass
417,Michael Williams,"Communication, Graphic Design (Beginner), Problem Solving, Java (Basics)",Gaming,Graduate
418,Amanda Jenkins,"Basic Computer Literacy, Python (Basics), Social Media Management, Java (Basics)",Music,12th Pass
419,Frank Nelson,"Sales, Marketing, Python (Basics), Microsoft Office, Graphic Design (Beginner)","Writing, Technology, Helping Others",Diploma Holder
420,Matthew Reyes,"Problem Solving, Sales, Data Entry, Basic Computer Literacy, Communication","Music, Movies, Sports",Diploma Holder
421,Patrick Holland,"Python (Basics), Teamwork, Basic Computer Literacy",Music,Undergraduate (In Progress)
422,Brandi Parker,"Graphic Design (Beginner), Data Entry, Sales",Entrepreneurship,Diploma Holder
423,Keith White,"Java (Basics), SQL (Basics)",Writing,10th Pass
424,Ryan White,"Marketing, Microsoft Office, Java (Basics)",Entrepreneurship,Graduate
425,Brian Stanley,"Typing, Basic Computer Literacy, Video Editing (Beginner), Marketing, Python (Basics)",Movies,12th Pass
426,Joshua Morrow,"Java (Basics), Customer Service","Helping Others, Technology",Diploma Holder
427,Tracey Drake,"Java (Basics), Communication, SQL (Basics), Basic Computer Literacy","Technology, Entrepreneurship, Creative Arts",12th Pass
428,Wesley Parker,"Social Media Management, SQL (Basics)",Movies,12th Pass
429,Brian Williams,"Customer Service, Data Entry",Technology,12th Pass
430,Brittany Hudson,"Python (Basics), Typing, Marketing, Social Media Management",Reading,12th Pass
431,Benjamin Zimmerman,"Social Media Management, Customer Service","Social Media, Movies",Undergraduate (In Progress)
432,Laura Williams,"Microsoft Office, SQL (Basics), Customer Service, HTML/CSS (Basics)","Technology, Social Media, Writing",Undergraduate (In Progress)
433,James Townsend,"Typing, Graphic Design (Beginner), Communication","Reading, Creative Arts",Undergraduate (In Progress)
434,Tony Wilson,"Sales, Python (Basics), Teamwork, Typing, Video Editing (Beginner)","Creative Arts, Music",Graduate
435,Austin Floyd,"Communication, Problem Solving","Music, Helping Others",10th Pass
436,Rebecca Burns,"Graphic Design (Beginner), HTML/CSS (Basics), Data Entry","Writing, Creative Arts",Diploma Holder
437,Ashley Holden,"Customer Service, SQL (Basics)","Reading, Social Media",Graduate
438,Vicki Hopkins,"Social Media Management, Microsoft Office, Teamwork, Graphic Design (Beginner), Python (Basics)",Sports,10th Pass
439,Adam Wilson,"Communication, Social Media Management, Basic Computer Literacy, Microsoft Office, Problem Solving",Creative Arts,10th Pass
440,Omar Frost,"HTML/CSS (Basics), Teamwork, Java (Basics)","Entrepreneurship, Movies",Diploma Holder
441,Mr. Gary Madden,"Video Editing (Beginner), SQL (Basics)",Creative Arts,Undergraduate (In Progress)
442,Ashley Pratt,"Python (Basics), Customer Service, Marketing, Data Entry, Video Editing (Beginner)","Social Media, Gaming, Creative Arts",Diploma Holder
443,John Kim,"Basic Computer Literacy, Data Entry, Problem Solving",Helping Others,Diploma Holder
444,Allen Crane,"Social Media Management, Customer Service, Data Entry","Entrepreneurship, Sports, Helping Others",12th Pass
445,Nathaniel Elliott,"Typing, Problem Solving, Data Entry, Customer Service","Social Media, Music, Creative Arts",Graduate
446,Mary Castaneda,"Teamwork, HTML/CSS (Basics), SQL (Basics)",Social Media,Undergraduate (In Progress)
447,Thomas Delacruz,"Java (Basics), Video Editing (Beginner), SQL (Basics), Marketing","Reading, Helping Others",10th Pass
448,Michael Dean,"Marketing, Typing, HTML/CSS (Basics)","Social Media, Helping Others",Diploma Holder
449,James Ramirez,"Python (Basics), SQL (Basics), Communication, Sales",Sports,Undergraduate (In Progress)
450,Susan Edwards,"Python (Basics), Teamwork, Typing",Technology,Diploma Holder
451,Mario Bennett,"Data Entry, HTML/CSS (Basics)","Entrepreneurship, Helping Others",Undergraduate (In Progress)
452,Gina Hernandez,"Video Editing (Beginner), Basic Computer Literacy, HTML/CSS (Basics)","Social Media, Sports, Movies",10th Pass
453,Russell Banks,"HTML/CSS (Basics), Typing, Graphic Design (Beginner), Video Editing (Beginner), Communication","Technology, Reading",Undergraduate (In Progress)
454,Ashley Fowler,"Social Media Management, Typing",Social Media,10th Pass
